{
  "id": "c-lm-c05-fluvial-fc94",
  "kind": "landmark",
  "tier": "bound",
  "title": "Ford under Dunesea",
  "bind": {
    "handle": "c05/fluvial/h-93fc94",
    "expect": {
      "type": "alluvial-fan",
      "sizeKm": [
        2.3,
        8
      ]
    }
  },
  "networkAnchor": false,
  "prose": "frontier",
  "properties": [],
  "lore": {
    "note": "A spread of stone and grit laid out where a steep stream hits the flat and slows.",
    "labelAnchor": "north",
    "source": "content/world/lexicon/landforms.json#alluvial-fan.gloss"
  },
  "resolution": null
}
