{
  "id": "c-lm-c02-wetland-c0fc",
  "kind": "landmark",
  "tier": "bound",
  "title": "Mire at Gildbourne",
  "bind": {
    "handle": "c02/wetland/h-f9c0fc",
    "expect": {
      "type": "peat-hag",
      "sizeKm": [
        0.09,
        0.34
      ]
    }
  },
  "networkAnchor": false,
  "prose": "frontier",
  "properties": [],
  "lore": {
    "note": "A ragged bank of bare peat where the surface tore open and started washing away.",
    "labelAnchor": "north",
    "source": "content/world/lexicon/landforms.json#peat-hag.gloss"
  },
  "resolution": null
}
