{
  "id": "c-lm-c04-coastal-1d9b",
  "kind": "landmark",
  "tier": "bound",
  "title": "Clintsink Stack",
  "bind": {
    "handle": "c04/coastal/h-c31d9b",
    "expect": {
      "type": "cuspate-foreland",
      "sizeKm": [
        2.38,
        7
      ]
    }
  },
  "networkAnchor": false,
  "prose": "frontier",
  "properties": [],
  "lore": {
    "note": "A blunt triangle of shingle thrown out from the coast where two drifts meet.",
    "labelAnchor": "north",
    "source": "content/world/lexicon/landforms.json#cuspate-foreland.gloss"
  },
  "resolution": null
}
