{
  "id": "c-lm-c04-karst-0e20",
  "kind": "landmark",
  "tier": "bound",
  "title": "Sink below Stonemoor",
  "bind": {
    "handle": "c04/karst/h-cb0e20",
    "expect": {
      "type": "karst-cenote",
      "sizeKm": [
        0.15,
        0.6
      ]
    }
  },
  "networkAnchor": false,
  "prose": "frontier",
  "properties": [],
  "lore": {
    "note": "A collapsed limestone shaft flooded to the water table.",
    "labelAnchor": "north",
    "source": "content/world/lexicon/landforms.json#karst-cenote.gloss"
  },
  "resolution": null
}
